<?xml version="1.0" encoding="UTF-8"?> 
<alumno 
xmlns:xsi="http://www.w3.org/2001/XMLSchema-instance" 
xsi:noNamespaceSchemaLocation="4_0_EjemploInicial2.xsd">  
	<nombre>Paco</nombre>  
	<apellidos>Seron</apellidos>  
	<direccion>Ayala</direccion>  
	<CP>28021</CP>  
	<edad>24</edad>  
	<ciclo_formativo>ASIR</ciclo_formativo>  
	<clave_ciclo>ASI123</clave_ciclo> 
</alumno>